{
  "$schema": "../schemas/registry.schema.json",
  "version": 1,
  "doc": "The roles. Each has a domain, an archetype, its capabilities, and the skills, tools and gates those carry. The nucleus is the set the client adapters are generated for; here every role is in it.",
  "provenance": {
    "sources": []
  },
  "agents": [
    {
      "id": "engineering.implementer",
      "name": "Implementer",
      "domain": "engineering",
      "archetype": "owner",
      "capabilities": [
        "code.implementation",
        "qa.testing"
      ],
      "skills": [
        "simplify",
        "testing-strategy",
        "working-with-the-harness"
      ],
      "tools": [
        "edit",
        "git.read",
        "project.test",
        "read",
        "search"
      ],
      "gates": [
        "format",
        "test.touched"
      ],
      "max_trust": "T2",
      "tags": [],
      "status": "active",
      "nucleus": true
    },
    {
      "id": "engineering.refactorer",
      "name": "Refactoring engineer",
      "domain": "engineering",
      "archetype": "owner",
      "capabilities": [
        "code.implementation",
        "code.refactor"
      ],
      "skills": [
        "simplify",
        "testing-strategy",
        "working-with-the-harness"
      ],
      "tools": [
        "edit",
        "git.read",
        "project.test",
        "read",
        "search"
      ],
      "gates": [
        "format",
        "test.all",
        "test.touched"
      ],
      "max_trust": "T2",
      "tags": [],
      "status": "active",
      "nucleus": true
    },
    {
      "id": "governance.work_lead",
      "name": "Work lead",
      "domain": "governance",
      "archetype": "coordinator",
      "capabilities": [
        "governance.planning",
        "governance.routing"
      ],
      "skills": [
        "decision-records",
        "working-with-the-harness"
      ],
      "tools": [
        "git.read",
        "read",
        "search"
      ],
      "gates": [],
      "max_trust": "T2",
      "tags": [],
      "status": "active",
      "nucleus": true
    },
    {
      "id": "governance.architecture_lead",
      "name": "Architecture lead",
      "domain": "governance",
      "archetype": "coordinator",
      "capabilities": [
        "architecture.system",
        "governance.decision_record",
        "governance.risk"
      ],
      "skills": [
        "decision-records",
        "security-baseline",
        "working-with-the-harness"
      ],
      "tools": [
        "edit",
        "git.read",
        "read",
        "search"
      ],
      "gates": [
        "build"
      ],
      "max_trust": "T3",
      "tags": [],
      "status": "active",
      "nucleus": true
    },
    {
      "id": "governance.product_lead",
      "name": "Product lead",
      "domain": "governance",
      "archetype": "coordinator",
      "capabilities": [
        "governance.planning",
        "governance.risk"
      ],
      "skills": [
        "decision-records",
        "security-baseline",
        "working-with-the-harness"
      ],
      "tools": [
        "git.read",
        "read",
        "search"
      ],
      "gates": [],
      "max_trust": "T2",
      "tags": [],
      "status": "active",
      "nucleus": true
    },
    {
      "id": "governance.intake_triager",
      "name": "Intake triager",
      "domain": "governance",
      "archetype": "coordinator",
      "capabilities": [
        "governance.escalation",
        "governance.routing"
      ],
      "skills": [
        "decision-records",
        "working-with-the-harness"
      ],
      "tools": [
        "git.read",
        "read",
        "search"
      ],
      "gates": [],
      "max_trust": "T1",
      "tags": [],
      "status": "active",
      "nucleus": true
    },
    {
      "id": "architecture.system_designer",
      "name": "System designer",
      "domain": "architecture",
      "archetype": "owner",
      "capabilities": [
        "architecture.data",
        "architecture.system"
      ],
      "skills": [
        "decision-records"
      ],
      "tools": [
        "git.read",
        "read",
        "search"
      ],
      "gates": [
        "build"
      ],
      "max_trust": "T2",
      "tags": [],
      "status": "active",
      "nucleus": true
    },
    {
      "id": "architecture.api_designer",
      "name": "API designer",
      "domain": "architecture",
      "archetype": "owner",
      "capabilities": [
        "architecture.api",
        "code.implementation"
      ],
      "skills": [
        "decision-records",
        "simplify",
        "testing-strategy"
      ],
      "tools": [
        "edit",
        "git.read",
        "project.test",
        "read",
        "search"
      ],
      "gates": [
        "format",
        "test.touched"
      ],
      "max_trust": "T2",
      "tags": [],
      "status": "active",
      "nucleus": true
    },
    {
      "id": "architecture.decision_recorder",
      "name": "Decision recorder",
      "domain": "architecture",
      "archetype": "steward",
      "capabilities": [
        "docs.authoring",
        "governance.decision_record"
      ],
      "skills": [
        "decision-records",
        "documentation"
      ],
      "tools": [
        "edit",
        "read",
        "search"
      ],
      "gates": [],
      "max_trust": "T1",
      "tags": [],
      "status": "active",
      "nucleus": true
    },
    {
      "id": "research.investigator",
      "name": "Investigator",
      "domain": "research",
      "archetype": "investigator",
      "capabilities": [
        "research.discovery",
        "research.evidence"
      ],
      "skills": [
        "research-method"
      ],
      "tools": [
        "browser",
        "read",
        "search"
      ],
      "gates": [],
      "max_trust": "T1",
      "tags": [],
      "status": "active",
      "nucleus": true
    },
    {
      "id": "research.prior_art_scout",
      "name": "Prior-art scout",
      "domain": "research",
      "archetype": "investigator",
      "capabilities": [
        "research.discovery",
        "research.prior_art"
      ],
      "skills": [
        "research-method"
      ],
      "tools": [
        "browser",
        "git.read",
        "read",
        "search"
      ],
      "gates": [],
      "max_trust": "T1",
      "tags": [],
      "status": "active",
      "nucleus": true
    },
    {
      "id": "docs.writer",
      "name": "Technical writer",
      "domain": "docs",
      "archetype": "owner",
      "capabilities": [
        "docs.authoring"
      ],
      "skills": [
        "documentation"
      ],
      "tools": [
        "edit",
        "read",
        "search"
      ],
      "gates": [],
      "max_trust": "T2",
      "tags": [],
      "status": "active",
      "nucleus": true
    },
    {
      "id": "docs.drift_checker",
      "name": "Documentation drift checker",
      "domain": "docs",
      "archetype": "adversary",
      "capabilities": [
        "docs.drift"
      ],
      "skills": [
        "documentation"
      ],
      "tools": [
        "git.read",
        "read",
        "search"
      ],
      "gates": [],
      "max_trust": "T1",
      "tags": [],
      "status": "active",
      "nucleus": true
    },
    {
      "id": "qa.test_architect",
      "name": "Test architect",
      "domain": "qa",
      "archetype": "owner",
      "capabilities": [
        "qa.property",
        "qa.testing"
      ],
      "skills": [
        "testing-strategy"
      ],
      "tools": [
        "edit",
        "project.test",
        "read",
        "search"
      ],
      "gates": [
        "test.touched"
      ],
      "max_trust": "T2",
      "tags": [],
      "status": "active",
      "nucleus": true
    },
    {
      "id": "qa.regression_tracker",
      "name": "Regression tracker",
      "domain": "qa",
      "archetype": "investigator",
      "capabilities": [
        "qa.regression",
        "qa.testing"
      ],
      "skills": [
        "testing-strategy"
      ],
      "tools": [
        "edit",
        "git.read",
        "project.test",
        "read",
        "search"
      ],
      "gates": [
        "test.all",
        "test.touched"
      ],
      "max_trust": "T2",
      "tags": [],
      "status": "active",
      "nucleus": true
    },
    {
      "id": "qa.release_verifier",
      "name": "Release verifier",
      "domain": "qa",
      "archetype": "adversary",
      "capabilities": [
        "qa.e2e",
        "qa.regression"
      ],
      "skills": [
        "testing-strategy"
      ],
      "tools": [
        "browser",
        "edit",
        "git.read",
        "project.test",
        "read",
        "search"
      ],
      "gates": [
        "test.all"
      ],
      "max_trust": "T2",
      "tags": [],
      "status": "active",
      "nucleus": true
    },
    {
      "id": "qa.property_tester",
      "name": "Property tester",
      "domain": "qa",
      "archetype": "owner",
      "capabilities": [
        "qa.property"
      ],
      "skills": [
        "testing-strategy"
      ],
      "tools": [
        "edit",
        "project.test",
        "read",
        "search"
      ],
      "gates": [
        "test.touched"
      ],
      "max_trust": "T2",
      "tags": [],
      "status": "active",
      "nucleus": true
    },
    {
      "id": "qa.e2e_tester",
      "name": "End-to-end tester",
      "domain": "qa",
      "archetype": "owner",
      "capabilities": [
        "qa.e2e"
      ],
      "skills": [
        "testing-strategy"
      ],
      "tools": [
        "browser",
        "edit",
        "project.test",
        "read"
      ],
      "gates": [
        "test.all"
      ],
      "max_trust": "T2",
      "tags": [],
      "status": "active",
      "nucleus": true
    },
    {
      "id": "qa.performance_analyst",
      "name": "Performance analyst",
      "domain": "qa",
      "archetype": "investigator",
      "capabilities": [
        "qa.performance"